{"description":"20 pinned file-reviewed mathematical sources replacing the disabled NIST lane; one-time bounded feed, no automatic algorithm qualification.","registration_defaults":{"deterministic_jitter_seconds":0,"enabled":false},"schema_version":1,"source_policy_ref":"resources/policies/internet/default-source-policy-v1.json","watches":[{"accepted_mime_types":["text/plain"],"canonical_url":"https://raw.githubusercontent.com/fredrik-johansson/fungrim/b7c3ca6e565e1058638cab6ba2bc811090296767/pygrim/formulas/beta_function.py","controlling_publisher":"Fungrim contributors","deterministic_jitter_seconds":14464,"enabled":true,"extraction_strategy":"mathematical-source-v1","license":{"classification":"MIT","evidence_urls":["https://raw.githubusercontent.com/fredrik-johansson/fungrim/b7c3ca6e565e1058638cab6ba2bc811090296767/LICENSE"],"status":"verified"},"name":"fungrim-beta-function","polling_interval_seconds":2592000,"purpose":"authoritative-evidence","robots":{"declared_status":"pending","required":true},"source_group":"fungrim","source_review":{"body_sha256":"f071c9ae16c9d0bf613a17781e20b856345a6c3e68c52a0ea571968132c33136","license_notices":[{"sha256":"ddb9a5a27f20c40396e39fb252a6ca1e1bfa62ae31ccd832026ce18ed94107a5","text":"MIT License\n\nCopyright (c) 2019 Fredrik Johansson\n\nPermission is hereby granted, free of charge, to any person obtaining a copy\nof this software and associated documentation files (the \"Software\"), to deal\nin the Software without restriction, including without limitation the rights\nto use, copy, modify, merge, publish, distribute, sublicense, and/or sell\ncopies of the Software, and to permit persons to whom the Software is\nfurnished to do so, subject to the following conditions:\n\nThe above copyright notice and this permission notice shall be included in all\ncopies or substantial portions of the Software.\n\nTHE SOFTWARE IS PROVIDED \"AS IS\", WITHOUT WARRANTY OF ANY KIND, EXPRESS OR\nIMPLIED, INCLUDING BUT NOT LIMITED TO THE WARRANTIES OF MERCHANTABILITY,\nFITNESS FOR A PARTICULAR PURPOSE AND NONINFRINGEMENT. IN NO EVENT SHALL THE\nAUTHORS OR COPYRIGHT HOLDERS BE LIABLE FOR ANY CLAIM, DAMAGES OR OTHER\nLIABILITY, WHETHER IN AN ACTION OF CONTRACT, TORT OR OTHERWISE, ARISING FROM,\nOUT OF OR IN CONNECTION WITH THE SOFTWARE OR THE USE OR OTHER DEALINGS IN THE\nSOFTWARE.\n","url":"https://raw.githubusercontent.com/fredrik-johansson/fungrim/b7c3ca6e565e1058638cab6ba2bc811090296767/LICENSE"}],"reviewed_at":"2026-09-05","reviewer":"assistant-assisted-file-notice-review","revision":"b7c3ca6e565e1058638cab6ba2bc811090296767","scope":"Only the exact listed UTF-8 source files as inert quoted data with full notices retained; no code execution, image acquisition, include expansion or linked-source ingestion.","status":"approved","third_party_review":"Inspected each selected file for license overrides and external material. Repository MIT notice applies; mathematical references and ImageSource names remain citations only. Referenced works, images and imported modules are excluded and not licensed by this review."},"stability":"immutable","subject":"mathematical-functions-and-numerical-methods","tier":2},{"accepted_mime_types":["text/plain"],"canonical_url":"https://raw.githubusercontent.com/fredrik-johansson/fungrim/b7c3ca6e565e1058638cab6ba2bc811090296767/pygrim/formulas/chebyshev.py","controlling_publisher":"Fungrim contributors","deterministic_jitter_seconds":17769,"enabled":true,"extraction_strategy":"mathematical-source-v1","license":{"classification":"MIT","evidence_urls":["https://raw.githubusercontent.com/fredrik-johansson/fungrim/b7c3ca6e565e1058638cab6ba2bc811090296767/LICENSE"],"status":"verified"},"name":"fungrim-chebyshev","polling_interval_seconds":2592000,"purpose":"authoritative-evidence","robots":{"declared_status":"pending","required":true},"source_group":"fungrim","source_review":{"body_sha256":"8f4b0df5f636d89b0ddcbdf799d68f4197eb60a8d0296b41fac373980253377e","license_notices":[{"sha256":"ddb9a5a27f20c40396e39fb252a6ca1e1bfa62ae31ccd832026ce18ed94107a5","text":"MIT License\n\nCopyright (c) 2019 Fredrik Johansson\n\nPermission is hereby granted, free of charge, to any person obtaining a copy\nof this software and associated documentation files (the \"Software\"), to deal\nin the Software without restriction, including without limitation the rights\nto use, copy, modify, merge, publish, distribute, sublicense, and/or sell\ncopies of the Software, and to permit persons to whom the Software is\nfurnished to do so, subject to the following conditions:\n\nThe above copyright notice and this permission notice shall be included in all\ncopies or substantial portions of the Software.\n\nTHE SOFTWARE IS PROVIDED \"AS IS\", WITHOUT WARRANTY OF ANY KIND, EXPRESS OR\nIMPLIED, INCLUDING BUT NOT LIMITED TO THE WARRANTIES OF MERCHANTABILITY,\nFITNESS FOR A PARTICULAR PURPOSE AND NONINFRINGEMENT. IN NO EVENT SHALL THE\nAUTHORS OR COPYRIGHT HOLDERS BE LIABLE FOR ANY CLAIM, DAMAGES OR OTHER\nLIABILITY, WHETHER IN AN ACTION OF CONTRACT, TORT OR OTHERWISE, ARISING FROM,\nOUT OF OR IN CONNECTION WITH THE SOFTWARE OR THE USE OR OTHER DEALINGS IN THE\nSOFTWARE.\n","url":"https://raw.githubusercontent.com/fredrik-johansson/fungrim/b7c3ca6e565e1058638cab6ba2bc811090296767/LICENSE"}],"reviewed_at":"2026-09-05","reviewer":"assistant-assisted-file-notice-review","revision":"b7c3ca6e565e1058638cab6ba2bc811090296767","scope":"Only the exact listed UTF-8 source files as inert quoted data with full notices retained; no code execution, image acquisition, include expansion or linked-source ingestion.","status":"approved","third_party_review":"Inspected each selected file for license overrides and external material. Repository MIT notice applies; mathematical references and ImageSource names remain citations only. Referenced works, images and imported modules are excluded and not licensed by this review."},"stability":"immutable","subject":"mathematical-functions-and-numerical-methods","tier":2},{"accepted_mime_types":["text/plain"],"canonical_url":"https://raw.githubusercontent.com/fredrik-johansson/fungrim/b7c3ca6e565e1058638cab6ba2bc811090296767/pygrim/formulas/error_functions.py","controlling_publisher":"Fungrim contributors","deterministic_jitter_seconds":16568,"enabled":true,"extraction_strategy":"mathematical-source-v1","license":{"classification":"MIT","evidence_urls":["https://raw.githubusercontent.com/fredrik-johansson/fungrim/b7c3ca6e565e1058638cab6ba2bc811090296767/LICENSE"],"status":"verified"},"name":"fungrim-error-functions","polling_interval_seconds":2592000,"purpose":"authoritative-evidence","robots":{"declared_status":"pending","required":true},"source_group":"fungrim","source_review":{"body_sha256":"556687bd1eb7a14a61e1c46870e1aefab94199be0f2fe4275e61befe3389cfe3","license_notices":[{"sha256":"ddb9a5a27f20c40396e39fb252a6ca1e1bfa62ae31ccd832026ce18ed94107a5","text":"MIT License\n\nCopyright (c) 2019 Fredrik Johansson\n\nPermission is hereby granted, free of charge, to any person obtaining a copy\nof this software and associated documentation files (the \"Software\"), to deal\nin the Software without restriction, including without limitation the rights\nto use, copy, modify, merge, publish, distribute, sublicense, and/or sell\ncopies of the Software, and to permit persons to whom the Software is\nfurnished to do so, subject to the following conditions:\n\nThe above copyright notice and this permission notice shall be included in all\ncopies or substantial portions of the Software.\n\nTHE SOFTWARE IS PROVIDED \"AS IS\", WITHOUT WARRANTY OF ANY KIND, EXPRESS OR\nIMPLIED, INCLUDING BUT NOT LIMITED TO THE WARRANTIES OF MERCHANTABILITY,\nFITNESS FOR A PARTICULAR PURPOSE AND NONINFRINGEMENT. IN NO EVENT SHALL THE\nAUTHORS OR COPYRIGHT HOLDERS BE LIABLE FOR ANY CLAIM, DAMAGES OR OTHER\nLIABILITY, WHETHER IN AN ACTION OF CONTRACT, TORT OR OTHERWISE, ARISING FROM,\nOUT OF OR IN CONNECTION WITH THE SOFTWARE OR THE USE OR OTHER DEALINGS IN THE\nSOFTWARE.\n","url":"https://raw.githubusercontent.com/fredrik-johansson/fungrim/b7c3ca6e565e1058638cab6ba2bc811090296767/LICENSE"}],"reviewed_at":"2026-09-05","reviewer":"assistant-assisted-file-notice-review","revision":"b7c3ca6e565e1058638cab6ba2bc811090296767","scope":"Only the exact listed UTF-8 source files as inert quoted data with full notices retained; no code execution, image acquisition, include expansion or linked-source ingestion.","status":"approved","third_party_review":"Inspected each selected file for license overrides and external material. Repository MIT notice applies; mathematical references and ImageSource names remain citations only. Referenced works, images and imported modules are excluded and not licensed by this review."},"stability":"immutable","subject":"mathematical-functions-and-numerical-methods","tier":2},{"accepted_mime_types":["text/plain"],"canonical_url":"https://raw.githubusercontent.com/fredrik-johansson/fungrim/b7c3ca6e565e1058638cab6ba2bc811090296767/pygrim/formulas/exp.py","controlling_publisher":"Fungrim contributors","deterministic_jitter_seconds":2171,"enabled":true,"extraction_strategy":"mathematical-source-v1","license":{"classification":"MIT","evidence_urls":["https://raw.githubusercontent.com/fredrik-johansson/fungrim/b7c3ca6e565e1058638cab6ba2bc811090296767/LICENSE"],"status":"verified"},"name":"fungrim-exp","polling_interval_seconds":2592000,"purpose":"authoritative-evidence","robots":{"declared_status":"pending","required":true},"source_group":"fungrim","source_review":{"body_sha256":"53a5e4c08f990549332ecdc110f93028f7f4ef1428886eb138906751cc87a21e","license_notices":[{"sha256":"ddb9a5a27f20c40396e39fb252a6ca1e1bfa62ae31ccd832026ce18ed94107a5","text":"MIT License\n\nCopyright (c) 2019 Fredrik Johansson\n\nPermission is hereby granted, free of charge, to any person obtaining a copy\nof this software and associated documentation files (the \"Software\"), to deal\nin the Software without restriction, including